{
  "$schema": "./diagram.schema.json",
  "version": "1.0",
  "metadata": {
    "name": "Monolit → Mikroserwisy",
    "description": "Przykładowy diagram rozbicia monolitu na frontend, backend i bazę danych",
    "createdAt": "2026-07-14T12:00:00.000Z",
    "updatedAt": "2026-07-15T16:45:30.143Z"
  },
  "viewport": {
    "x": 21.013819191082007,
    "y": 84.94902462198507,
    "zoom": 0.7578582832551991
  },
  "nodes": [
    {
      "id": "frontend",
      "type": "service",
      "label": "Frontend",
      "position": {
        "x": 368,
        "y": 48
      },
      "data": {
        "tech": [
          "Next.js",
          "React"
        ],
        "description": "Warstwa prezentacji — UI i routing",
        "status": "planned",
        "codeRef": null
      }
    },
    {
      "id": "backend",
      "type": "service",
      "label": "Backend API",
      "position": {
        "x": 368,
        "y": 272
      },
      "data": {
        "tech": [
          "Node.js",
          "Express"
        ],
        "description": "Logika biznesowa i endpointy REST",
        "status": "planned",
        "codeRef": null
      }
    },
    {
      "id": "database",
      "type": "database",
      "label": "PostgreSQL",
      "position": {
        "x": 688,
        "y": 512
      },
      "data": {
        "tech": [
          "PostgreSQL"
        ],
        "description": "Relacyjna baza danych",
        "status": "planned",
        "codeRef": null
      }
    },
    {
      "id": "auth-service",
      "type": "component",
      "label": "Auth Module",
      "position": {
        "x": 368,
        "y": 512
      },
      "data": {
        "tech": [
          "JWT",
          "OAuth"
        ],
        "description": "Moduł uwierzytelniania użytkowników",
        "status": "planned",
        "codeRef": null
      }
    },
    {
      "id": "redis",
      "type": "cache",
      "label": "Redis",
      "position": {
        "x": 48,
        "y": 512
      },
      "data": {
        "tech": [
          "Redis"
        ],
        "description": "Cache sesji i rate limiting",
        "status": "planned",
        "codeRef": null
      }
    },
    {
      "id": "api-gateway",
      "type": "service",
      "label": "API Gateway",
      "position": {
        "x": 688,
        "y": 48
      },
      "data": {
        "tech": [
          "Kong"
        ],
        "description": "Hot reload test node",
        "status": "planned",
        "codeRef": null
      }
    }
  ],
  "edges": [
    {
      "id": "fe-be",
      "source": "frontend",
      "target": "backend",
      "type": "http",
      "label": "REST API",
      "animated": false
    },
    {
      "id": "be-db",
      "source": "backend",
      "target": "database",
      "type": "data-flow",
      "label": "SQL queries",
      "animated": false
    },
    {
      "id": "be-auth",
      "source": "backend",
      "target": "auth-service",
      "type": "dependency",
      "label": "uses",
      "animated": false
    },
    {
      "id": "be-redis",
      "source": "backend",
      "target": "redis",
      "type": "data-flow",
      "label": "cache read/write",
      "animated": true
    }
  ]
}